{
  "$schema": "https://3webobs.com/schemas/entities.json",
  "version": "1.1",
  "generated": "2026-08-25",
  "primary_entity": {
    "id": "https://3webobs.com/#organization",
    "type": [
      "Organization",
      "Corporation"
    ],
    "name": "AIVENTURE S.R.L.",
    "url": "https://aiventure.ro/",
    "jurisdiction": "Romania, European Union",
    "email": "contact@5thelement.ai",
    "address": {
      "type": "PostalAddress",
      "street_address": "Drumul Pădurea Pustnicu, Nr. 141C, Corp A, Etaj 2",
      "address_locality": "București",
      "address_region": "București",
      "postal_code": null,
      "address_country": "RO"
    },
    "identifiers": [
      {
        "scheme": "CUI",
        "value": "51415878",
        "authority": "ANAF, Romania"
      },
      {
        "scheme": "Registrul Comerțului",
        "value": "J2025016406000",
        "authority": "ONRC, Romania"
      },
      {
        "scheme": "EUID",
        "value": "ROONRC.J2025016406000",
        "authority": "Business Registers Interconnection System (BRIS)"
      },
      {
        "scheme": "CAEN",
        "value": "6210",
        "label": "Custom software development"
      }
    ],
    "same_as": [
      "https://aiventure.ro/",
      "https://www.linkedin.com/company/107338970",
      "https://www.crunchbase.com/organization/aiventure-s-r-l",
      "https://www.facebook.com/people/Aiventure/61573220584246/"
    ]
  },
  "brands": [
    {
      "id": "https://3webobs.com/#brand",
      "type": "Brand",
      "name": "3webs",
      "alternate_names": [
        "3 webs",
        "3webobs",
        "3web obs",
        "3webobs.com",
        "3webs Visibility Engine"
      ],
      "url": "https://3webobs.com/",
      "owner": "https://3webobs.com/#organization",
      "description": "3webs observes how a public domain appears across the Human Web, AI Web and Machine Web and reports observable evidence."
    }
  ],
  "people": [
    {
      "id": "https://3webobs.com/#founder",
      "type": "Person",
      "name": "Dan Ionesco",
      "alternate_names": [
        "Dan Ionescu"
      ],
      "role": "Founder & CEO",
      "works_for": "https://3webobs.com/#organization",
      "same_as": [
        "https://ro.linkedin.com/in/dan-ionesco-a856082a0",
        "https://x.com/aipath512",
        "https://medium.com/@aipath512"
      ]
    }
  ],
  "services": [
    {
      "id": "https://3webobs.com/#service",
      "type": "Service",
      "name": "3webs Visibility Observation",
      "alternate_names": [
        "AI Visibility Observation"
      ],
      "url": "https://3webobs.com/",
      "provider": "https://3webobs.com/#organization",
      "brand": "https://3webobs.com/#brand",
      "description": "Point-in-time and longitudinal observation of publicly accessible web evidence across the Human Web, AI Web and Machine Web."
    }
  ],
  "software": [
    {
      "id": "https://3webobs.com/#software",
      "type": "SoftwareApplication",
      "name": "3webs Visibility Engine",
      "version": "3.6.1",
      "url": "https://3webobs.com/",
      "author": "https://3webobs.com/#organization",
      "publisher": "https://3webobs.com/#organization",
      "application_category": "WebApplication",
      "description": "Evidence-based observation engine evaluating 167 signals across AI Signals, AEO, GEO, AIO and SEO."
    }
  ],
  "concepts": [
    {
      "id": "https://3webobs.com/#term-human-web",
      "type": "DefinedTerm",
      "name": "Human Web",
      "definition": "The browser-facing web consumed primarily by people, including HTML, semantic structure, links, metadata, crawlability and observable delivery characteristics."
    },
    {
      "id": "https://3webobs.com/#term-ai-web",
      "type": "DefinedTerm",
      "name": "AI Web",
      "definition": "The information surface consumed by AI search systems, answer engines, retrieval systems and language-model-assisted discovery."
    },
    {
      "id": "https://3webobs.com/#term-machine-web",
      "type": "DefinedTerm",
      "name": "Machine Web",
      "definition": "The machine-facing surface through which software agents discover, interpret and, where explicitly supported, invoke capabilities."
    },
    {
      "id": "https://3webobs.com/#term-three-webs",
      "type": "DefinedTerm",
      "name": "Three Webs",
      "definition": "The 3webs observation model separating a domain's public delivery surface into Human Web, AI Web and Machine Web."
    },
    {
      "id": "https://3webobs.com/#term-adi",
      "type": "DefinedTerm",
      "name": "ADI",
      "alternate_name": "AI Delivery Infrastructure",
      "definition": "A machine-readable delivery layer through which an organization can expose identity, intent, capabilities, governance and verifiable evidence to AI systems and software agents."
    }
  ],
  "relationships": [
    {
      "subject": "https://3webobs.com/#organization",
      "predicate": "owns",
      "object": "https://3webobs.com/#brand"
    },
    {
      "subject": "https://3webobs.com/#organization",
      "predicate": "operates",
      "object": "https://3webobs.com/#service"
    },
    {
      "subject": "https://3webobs.com/#organization",
      "predicate": "develops",
      "object": "https://3webobs.com/#software"
    },
    {
      "subject": "https://3webobs.com/#service",
      "predicate": "implemented_by",
      "object": "https://3webobs.com/#software"
    }
  ],
  "network": {
    "name": "AiVenture ADI Network",
    "role": "observation_node",
    "root": "https://5thelement.ai/",
    "descriptor": "https://3webobs.com/adn.json",
    "membership": "https://3webobs.com/network.json"
  },
  "network_peers": [
    {
      "domain": "5thelement.ai",
      "url": "https://5thelement.ai/",
      "relation": "network_root_and_technology_flagship"
    },
    {
      "domain": "aiventure.ro",
      "url": "https://aiventure.ro/",
      "relation": "operator_delivery_domain"
    },
    {
      "domain": "1clic-ia.eu",
      "url": "https://1clic-ia.eu/",
      "relation": "network_sibling"
    }
  ],
  "resolution": {
    "canonical_brand": "3webs",
    "canonical_service_url": "https://3webobs.com/",
    "legal_operator": "AIVENTURE S.R.L.",
    "aliases": "https://3webobs.com/aliases.json",
    "authority": "https://3webobs.com/authority.json"
  }
}
